{
  "$schema": "https://json-schema.org/draft/2020-12/schema",
  "title": "OrderPlaced v1",
  "description": "Accepted and persisted order intent, not inventory reservation.",
  "type": "object",
  "additionalProperties": false,
  "required": ["eventId", "eventType", "schemaVersion", "occurredAt", "orderId", "correlationId", "lines"],
  "properties": {
    "eventId": {"type": "string", "format": "uuid"},
    "eventType": {"type": "string", "const": "OrderPlaced"},
    "schemaVersion": {"type": "integer", "const": 1},
    "occurredAt": {"type": "string", "format": "date-time"},
    "orderId": {"type": "string", "format": "uuid"},
    "correlationId": {"type": "string", "pattern": "^[A-Za-z0-9._:-]{1,128}$"},
    "lines": {
      "type": "array",
      "minItems": 1,
      "items": {
        "type": "object",
        "additionalProperties": false,
        "required": ["sku", "quantity"],
        "properties": {
          "sku": {"type": "string", "minLength": 1, "maxLength": 64, "pattern": "\\S"},
          "quantity": {"type": "integer", "minimum": 1, "maximum": 2147483647}
        }
      }
    }
  }
}
